,NCTId,ExclusionCriteriaEmbedClean,Correct,TopicName,Topics,TopicProbs
409,NCT05061745,individuals adults  infants  children  teenagers ,Y,pregnant_pregnancy_women_planning_breastfeeding_female_feeding_breast_potential_child,1,1
81,NCT04622930,acute  active suicidal ideation indicated clinical judgment score ≥ 2 suicidal ideation subscale c ssrs,Y,disorder_history_use_months_current_disease_severe_prior_treatment_heart,0,1
324,NCT03093636,abnormal liver function test results  transaminase >3 times upper limit normal ,Y,mmhg_blood_pressure_ml_60_diastolic_hba1c_min_tsh_cm,3,0.875703355
409,NCT05061745,significant auditory visual impairment prevents participants virtual reality headset.,Y,disorder_history_use_months_current_disease_severe_prior_treatment_heart,0,1
86,NCT03475147,scotoma ocular disorder,Y,disorder_history_use_months_current_disease_severe_prior_treatment_heart,0,0.57519056
118,NCT04428645,active infection.,Y,disorder_history_use_months_current_disease_severe_prior_treatment_heart,0,1
131,NCT04424888,subjects received experimental drug 30 days prior entry,Y,disorder_history_use_months_current_disease_severe_prior_treatment_heart,0,1
215,NCT04244786,current psychotic disorder  mania  hypomania  intellectual disability,Y,disorder_history_use_months_current_disease_severe_prior_treatment_heart,0,1
211,NCT05212129,hearing impaired,Y,disorder_history_use_months_current_disease_severe_prior_treatment_heart,0,1
169,NCT05310227,pregnant breastfeeding females,Y,pregnant_pregnancy_women_planning_breastfeeding_female_feeding_breast_potential_child,1,0.88550059
346,NCT04468074,applicants  pregnant  planning pregnancy  breastfeeding,Y,pregnant_pregnancy_women_planning_breastfeeding_female_feeding_breast_potential_child,1,1
378,NCT04449341,currently experiencing headache migraine,Y,disorder_history_use_months_current_disease_severe_prior_treatment_heart,0,0.684887055
138,NCT04607460,psychotic disorder  dissociative disorder  psychiatric condition required hospitalization past year judged interfere participation.,Y,disorder_history_use_months_current_disease_severe_prior_treatment_heart,0,1
51,NCT04484779,vision loss vision impairment allow recognition mma screen features.,Y,disorder_history_use_months_current_disease_severe_prior_treatment_heart,0,0.703920324
444,NCT05353296,unstable depression insomnia medication regimen,Y,disorder_history_use_months_current_disease_severe_prior_treatment_heart,0,0.723966601
313,NCT04900285,ongoing prior use dental device,Y,disorder_history_use_months_current_disease_severe_prior_treatment_heart,0,1
24,NCT05421624,history >1 fall past 3 months,Y,disorder_history_use_months_current_disease_severe_prior_treatment_heart,0,0.844917422
30,NCT05365607,current substance  including marijuana  alcohol use disorder  past 12 months  scid 5  methods research strategy . adults past substance alcohol use disorders allowed participate.,Y,disorder_history_use_months_current_disease_severe_prior_treatment_heart,0,1
199,NCT04142229,hemophilia bleeding disorder,Y,disorder_history_use_months_current_disease_severe_prior_treatment_heart,0,0.508813494
246,NCT04888169,active suicidality.,Y,disorder_history_use_months_current_disease_severe_prior_treatment_heart,0,0.747156026
241,NCT05166707,current previous symptoms psychosis  including delusions  history consistent psychotic disorder  opinion investigator,Y,disorder_history_use_months_current_disease_severe_prior_treatment_heart,0,0.978202275
102,NCT05371470,active substance use.,Y,disorder_history_use_months_current_disease_severe_prior_treatment_heart,0,1
168,NCT04664881,patients planned staged pci index hospitalization,Y,disorder_history_use_months_current_disease_severe_prior_treatment_heart,0,0.885632598
134,NCT03224234,cardiac status nyha iii iv,Y,disorder_history_use_months_current_disease_severe_prior_treatment_heart,0,0.975813236
42,NCT05400837,mitral stenosis,Y,disorder_history_use_months_current_disease_severe_prior_treatment_heart,0,0.86792527
391,NCT05267704,patients lie supine renal biopsy excluded,Y,disorder_history_use_months_current_disease_severe_prior_treatment_heart,0,1
50,NCT03996876,lifetime history schizophrenia bipolar disorder i.,Y,disorder_history_use_months_current_disease_severe_prior_treatment_heart,0,0.711448002
134,NCT03224234,refusal inability informed consent,Y,consent_informed_provide_inability_sign_unable_written_unwillingness_willing_representative,4,0.822154839
324,NCT03093636,abuse alcohol recreational drugs,Y,disorder_history_use_months_current_disease_severe_prior_treatment_heart,0,1
378,NCT04449341,history motion sickness  nausea vertigo ,Y,disorder_history_use_months_current_disease_severe_prior_treatment_heart,0,1
290,NCT03335800,currently anti coagulation therapy.,Y,disorder_history_use_months_current_disease_severe_prior_treatment_heart,0,0.884788374
45,NCT04421131,willing sign informed consent,Y,consent_informed_provide_inability_sign_unable_written_unwillingness_willing_representative,4,0.831777732
199,NCT04142229,cystic fibrosis,Y,disorder_history_use_months_current_disease_severe_prior_treatment_heart,0,1
50,NCT03996876,medical conditions including seizure disorders  neurological disorders  moderate severe head injury  systemic illness affecting nervous system function  heart defect  medically unstable injuries.,Y,disorder_history_use_months_current_disease_severe_prior_treatment_heart,0,1
42,NCT05400837,presence artificial heart valve,Y,disorder_history_use_months_current_disease_severe_prior_treatment_heart,0,0.844155289
297,NCT02921776,severe uncorrected hearing loss,Y,disorder_history_use_months_current_disease_severe_prior_treatment_heart,0,1
375,NCT03372460,skin lesions site stimulation increase conductance   vascular moles angiomas ,Y,skin_cancer_allergy_known_cell_reaction_basal_allergic_adhesive_carcinoma,2,0.53714214
211,NCT05212129,pregnancy  evaluating md screens patients normally clinic visit  questioning  perform urine pregnancy test clinically indicated  absence menstrual period symptoms concerning pregnancy ,Y,pregnant_pregnancy_women_planning_breastfeeding_female_feeding_breast_potential_child,1,1
228,NCT04808141,known disorder indication spine surgery  i.e.  tumor  cauda equina syndrome ,Y,disorder_history_use_months_current_disease_severe_prior_treatment_heart,0,1
118,NCT04428645,current administration oral parenteral corticosteroids.,Y,disorder_history_use_months_current_disease_severe_prior_treatment_heart,0,1
0,NCT05375500,susceptibility motion sickness simulator sickness,Y,disorder_history_use_months_current_disease_severe_prior_treatment_heart,0,0.393018492
209,NCT04721067,pregnancy breastfeeding course study.,Y,pregnant_pregnancy_women_planning_breastfeeding_female_feeding_breast_potential_child,1,1
409,NCT05061745,changes psychotropic medication  taking psychotropic medication  changes supportive psychotherapy 1 month prior initial visit  clinically appropriate maintain stable treatment regimen duration trial,Y,disorder_history_use_months_current_disease_severe_prior_treatment_heart,0,1
141,NCT02925299,sickle cell disease  haemoglobinopathy  received red blood cell transfusion erythropoietin 3 months prior time screening,Y,disorder_history_use_months_current_disease_severe_prior_treatment_heart,0,0.602802881
153,NCT04112069,untreated inadequately treated mental illness  indicators include symptoms psychosis  hallucinations  mania  psychiatric hospitalization year  treatment anti psychotic medications known affect glucose regulation.,Y,disorder_history_use_months_current_disease_severe_prior_treatment_heart,0,0.781984907
141,NCT02925299,physical psychological disease likely interfere normal conduct interpretation results judged investigator,Y,disorder_history_use_months_current_disease_severe_prior_treatment_heart,0,1